{
  "$schema": "../schemas/typing.schema.json",
  "id": "es-passages",
  "name": "Español: pasajes breves",
  "language": "es",
  "kind": "quotes",
  "author": "KeyHalo contributors",
  "description": "Pasajes breves originales escritos para KeyHalo: vida diaria, hacer cosas, teclados, viajes, comida y ciencia.",
  "texts": [
    {
      "text": "El primer café de la mañana sabe mejor cuando la casa todavía está en silencio y la pantalla sigue apagada.",
      "source": "KeyHalo"
    },
    {
      "text": "Un buen teclado desaparece bajo tus manos. Dejas de pensar en teclas y empiezas a pensar en palabras.",
      "source": "KeyHalo"
    },
    {
      "text": "¿Por qué el pan recién hecho huele tan bien? Porque el horno convierte azúcares y proteínas en cientos de aromas distintos.",
      "source": "KeyHalo"
    },
    {
      "text": "La impresora del taller tiene carácter: unos días imprime perfecto y otros decide que hoy no es su día.",
      "source": "KeyHalo"
    },
    {
      "text": "La luz del Sol tarda poco más de ocho minutos en llegar a la Tierra, así que cada atardecer es una foto del pasado.",
      "source": "KeyHalo"
    },
    {
      "text": "El tren salió a su hora, algo que sorprendió a todos en el andén, incluido el revisor.",
      "source": "KeyHalo"
    },
    {
      "text": "Para hacer pan solo necesitas harina, agua, sal y paciencia. Casi todos tenemos lo primero y nos falta lo último.",
      "source": "KeyHalo"
    },
    {
      "text": "Etiquetó cada cable del cajón y, durante una semana gloriosa, pudo encontrar cualquier cosa a la primera.",
      "source": "KeyHalo"
    },
    {
      "text": "Los pulpos tienen tres corazones y sangre azul. Parecen personajes de un cuento muy extraño.",
      "source": "KeyHalo"
    },
    {
      "text": "El error no estaba en el código nuevo, sino en el comentario de arriba, que prometía algo que el código nunca hacía.",
      "source": "KeyHalo"
    },
    {
      "text": "Caminar por una ciudad sin mapa es la forma más rápida de encontrar la panadería que los vecinos nunca mencionan.",
      "source": "KeyHalo"
    },
    {
      "text": "Escribir rápido consiste sobre todo en no detenerse. Lento, constante y preciso gana a las ráfagas con pausas largas.",
      "source": "KeyHalo"
    },
    {
      "text": "La sopa estaba más rica al día siguiente, como si las verduras hubieran pasado la noche conociéndose.",
      "source": "KeyHalo"
    },
    {
      "text": "¡Qué difícil es elegir un solo color para el teclado cuando puedes tener dieciséis millones!",
      "source": "KeyHalo"
    },
    {
      "text": "Pasó una hora ajustando la iluminación del escritorio y luego la apagó porque no lo dejaba concentrarse.",
      "source": "KeyHalo"
    },
    {
      "text": "El conductor del autobús saludaba a todos los demás autobuses, un pequeño club que conoce cada bache de la ciudad.",
      "source": "KeyHalo"
    },
    {
      "text": "Una copia de seguridad que nunca has restaurado es solo una esperanza guardada en otro disco.",
      "source": "KeyHalo"
    },
    {
      "text": "El sonido viaja unas cuatro veces más rápido en el agua que en el aire; por eso las ballenas se oyen a través del océano.",
      "source": "KeyHalo"
    },
    {
      "text": "En marzo el jardín parecía vacío. En junio era una selva y nadie recordaba haber plantado la mitad.",
      "source": "KeyHalo"
    },
    {
      "text": "Soldar es fácil cuando entiendes que el soldador calienta la unión, y la unión funde el estaño, no al revés.",
      "source": "KeyHalo"
    },
    {
      "text": "Los mapas antiguos están llenos de errores seguros de sí mismos: ríos que nunca existieron e islas que cambiaban de sitio.",
      "source": "KeyHalo"
    },
    {
      "text": "Un poco de limón al final alegra cualquier plato. A veces es lo único que le falta a una receta sosa.",
      "source": "KeyHalo"
    },
    {
      "text": "La reunión pudo ser un correo, y el correo pudo ser una nota pegada en la nevera.",
      "source": "KeyHalo"
    },
    {
      "text": "Un rayo está más caliente que la superficie del Sol, pero dura tan poco que el aire a su alrededor estalla en un trueno.",
      "source": "KeyHalo"
    },
    {
      "text": "En los vuelos largos el tiempo se vuelve un rumor: desayunas dos veces y aun así llegas antes de salir.",
      "source": "KeyHalo"
    },
    {
      "text": "Practica despacio las letras difíciles. La velocidad es solo precisión repetida hasta que parece fácil.",
      "source": "KeyHalo"
    },
    {
      "text": "El gato ignoró la cama cara y se durmió en la caja de cartón en la que llegó.",
      "source": "KeyHalo"
    },
    {
      "text": "El bambú puede crecer casi un metro en un solo día; si tuvieras paciencia, podrías verlo crecer.",
      "source": "KeyHalo"
    },
    {
      "text": "La versión uno salió con una errata en la pantalla de inicio. La versión dos la corrigió y añadió tres nuevas.",
      "source": "KeyHalo"
    },
    {
      "text": "El mejor puesto de comida del mercado no tiene cartel, siempre tiene cola y su cocinera nunca levanta la vista.",
      "source": "KeyHalo"
    },
    {
      "text": "Tus dedos recuerdan los atajos mucho después de que tu cabeza olvide los menús que reemplazaron.",
      "source": "KeyHalo"
    },
    {
      "text": "La nieve apaga tanto el ruido de la ciudad que lo más fuerte de la calle acaba siendo el sonido de tus pasos.",
      "source": "KeyHalo"
    },
    {
      "text": "¿Sabías que la ñ nació de una n con una pequeña n encima? Los copistas ahorraban espacio y tinta.",
      "source": "KeyHalo"
    },
    {
      "text": "Las montañas parecen más cerca cuando el aire está limpio, por eso la última hora de la caminata siempre dura el doble.",
      "source": "KeyHalo"
    },
    {
      "text": "Un interruptor pensado para cincuenta millones de pulsaciones durará más que el cable, la carcasa y quien lo compró.",
      "source": "KeyHalo"
    }
  ]
}
