{
  "id": "en-passages",
  "name": "English: short passages",
  "language": "en",
  "kind": "quotes",
  "author": "KeyHalo contributors",
  "description": "Original short passages written for KeyHalo: everyday life, making things, keyboards, travel, food and science.",
  "texts": [
    { "text": "The first coffee of the morning tastes best when the house is still quiet and the screen is still dark.", "source": "KeyHalo" },
    { "text": "A good keyboard disappears under your hands. You stop thinking about keys and start thinking in words.", "source": "KeyHalo" },
    { "text": "Rain on a tin roof sounds louder at night, as if the dark gives every drop a little more room to land.", "source": "KeyHalo" },
    { "text": "Every printer in the workshop has a personality. One is fast and messy, one is slow and perfect, and one only works on Tuesdays.", "source": "KeyHalo" },
    { "text": "Light from the Sun takes a little over eight minutes to reach us, so every sunset is a picture of the recent past.", "source": "KeyHalo" },
    { "text": "The train left on time, which surprised everyone on the platform, including the conductor.", "source": "KeyHalo" },
    { "text": "Bread needs only flour, water, salt and patience. Most people have the first three and run out of the last one.", "source": "KeyHalo" },
    { "text": "She labelled every cable in the drawer, and for one glorious week she could find anything she wanted.", "source": "KeyHalo" },
    { "text": "Octopuses have three hearts and blue blood, which makes them sound like characters from a very strange fairy tale.", "source": "KeyHalo" },
    { "text": "The bug was not in the code he had just written. It was in the comment above it, which promised something the code never did.", "source": "KeyHalo" },
    { "text": "Walking through a new city without a map is the fastest way to find the bakery the locals never mention.", "source": "KeyHalo" },
    { "text": "Typing fast is mostly about not stopping. Slow, steady and accurate beats quick bursts followed by long pauses.", "source": "KeyHalo" },
    { "text": "The soup was better on the second day, as if the vegetables had spent the night getting to know each other.", "source": "KeyHalo" },
    { "text": "Honey found in ancient tombs was still safe to eat, because almost nothing can grow in something that sweet and dry.", "source": "KeyHalo" },
    { "text": "He spent an hour tuning the lighting on his desk, then turned it off because it was distracting him from work.", "source": "KeyHalo" },
    { "text": "The bus driver waved at every other bus on the route, a small club of people who know every pothole in town.", "source": "KeyHalo" },
    { "text": "A backup you have never restored is just a hope stored on another disk.", "source": "KeyHalo" },
    { "text": "Sound travels about four times faster in water than in air, which is why whales can hear each other across an ocean.", "source": "KeyHalo" },
    { "text": "The garden looked empty in March. By June it was a jungle, and nobody remembered planting half of it.", "source": "KeyHalo" },
    { "text": "Soldering is easy once you learn that the iron heats the joint, and the joint melts the solder, not the other way round.", "source": "KeyHalo" },
    { "text": "Old maps are full of confident mistakes: rivers that never existed and islands that moved every few years.", "source": "KeyHalo" },
    { "text": "Lemons make everything taste brighter. A little juice at the end can rescue a dish that tastes flat.", "source": "KeyHalo" },
    { "text": "The meeting could have been an email, and the email could have been a short note on the fridge.", "source": "KeyHalo" },
    { "text": "Lightning is hotter than the surface of the Sun, but it lasts so briefly that the air around it explodes into thunder.", "source": "KeyHalo" },
    { "text": "On long flights, time becomes a rumour. You eat breakfast twice and still arrive before you left.", "source": "KeyHalo" },
    { "text": "A tidy desk is not a sign of a tidy mind. It just means the mess has been moved into a drawer.", "source": "KeyHalo" },
    { "text": "Practise the hard letters slowly. Speed is just accuracy that has been repeated until it feels easy.", "source": "KeyHalo" },
    { "text": "The cat ignored the expensive bed and slept in the cardboard box it arrived in.", "source": "KeyHalo" },
    { "text": "Bamboo can grow almost a metre in a single day, fast enough that you could watch it if you had the patience.", "source": "KeyHalo" },
    { "text": "Version one shipped with a typo on the splash screen. Version two fixed it and added three new ones.", "source": "KeyHalo" },
    { "text": "The best street food stall in the market has no sign, a long queue and a cook who never looks up.", "source": "KeyHalo" },
    { "text": "Your fingers remember shortcuts long after your mind forgets the menus they replaced.", "source": "KeyHalo" },
    { "text": "Snow muffles a city so well that the loudest sound on the street becomes your own footsteps.", "source": "KeyHalo" },
    { "text": "A switch rated for fifty million presses will probably outlive the cable, the case and the person who bought it.", "source": "KeyHalo" },
    { "text": "Mountains look closer in clear air, which is why the last hour of a hike always seems to take twice as long.", "source": "KeyHalo" }
  ]
}
